{
  "protocol_version": "v1",
  "message_id": "88888888-8888-4888-8888-888888888888",
  "stream_id": "99999999-9999-4999-8999-999999999999",
  "message_sequence": 7,
  "message_type": "application",
  "sender_principal": "host:vera",
  "sender_signing_key_id": "4444444444444444444444444444444444444444444444444444444444444444",
  "sender_signing_key_epoch": 2,
  "recipient_principal": "phone:pixel",
  "recipient_hpke_key_id": "5555555555555555555555555555555555555555555555555555555555555555",
  "recipient_hpke_key_epoch": 3,
  "created_at": "2026-09-13T18:10:00Z",
  "expires_at": "2026-09-13T18:15:00Z",
  "ciphertext_base64": "aG9zdC1jaXBoZXJ0ZXh0",
  "ciphertext_sha256": "ad6c9f28bbac614cd6b5d742cc512bf2de7472e3ba6e8ab90727a2b1be373805",
  "hpke_suite": "DHKEM(X25519,HKDF-SHA256)-HKDF-SHA256-AES-128-GCM",
  "aad_binding": {
    "protocol_version": "v1",
    "message_id": "88888888-8888-4888-8888-888888888888",
    "stream_id": "99999999-9999-4999-8999-999999999999",
    "message_sequence": 7,
    "message_type": "application",
    "sender_principal": "host:vera",
    "sender_signing_key_id": "4444444444444444444444444444444444444444444444444444444444444444",
    "sender_signing_key_epoch": 2,
    "recipient_principal": "phone:pixel",
    "recipient_hpke_key_id": "5555555555555555555555555555555555555555555555555555555555555555",
    "recipient_hpke_key_epoch": 3
  },
  "aad_sha256": "b289139228b7804b6462482b4af724d374deb409b938fbd9d4a78d93fdbcf1d1",
  "envelope_sha256": "0e1c774def9c5d19ed1954a97a346887d4c16e28029d199b6f59ef14a18fae9e"
}
