{
  "protocol_version": "v1",
  "message_id": "11111111-1111-4111-8111-111111111111",
  "stream_id": "22222222-2222-4222-8222-222222222222",
  "message_sequence": 1,
  "message_type": "application",
  "sender_principal": "phone:pixel",
  "sender_signing_key_id": "1111111111111111111111111111111111111111111111111111111111111111",
  "sender_signing_key_epoch": 1,
  "recipient_principal": "host:vera",
  "recipient_hpke_key_id": "2222222222222222222222222222222222222222222222222222222222222222",
  "recipient_hpke_key_epoch": 1,
  "created_at": "2026-09-13T18:00:00Z",
  "expires_at": "2026-09-13T18:05:00Z",
  "ciphertext_base64": "dGVzdC1jaXBoZXJ0ZXh0",
  "ciphertext_sha256": "f7ad1fd6e4c042819565fba657bd637de32f140891d527626430b9d0ecbb92c6",
  "hpke_suite": "DHKEM(X25519,HKDF-SHA256)-HKDF-SHA256-AES-128-GCM",
  "aad_binding": {
    "protocol_version": "v1",
    "message_id": "11111111-1111-4111-8111-111111111111",
    "stream_id": "22222222-2222-4222-8222-222222222222",
    "message_sequence": 1,
    "message_type": "application",
    "sender_principal": "phone:pixel",
    "sender_signing_key_id": "1111111111111111111111111111111111111111111111111111111111111111",
    "sender_signing_key_epoch": 1,
    "recipient_principal": "host:vera",
    "recipient_hpke_key_id": "2222222222222222222222222222222222222222222222222222222222222222",
    "recipient_hpke_key_epoch": 1
  },
  "aad_sha256": "f38f029e9ab091667ab199baa20109f3b28e977aa5051314e805f499b0b39229",
  "envelope_sha256": "830f90faf787eed830d4f5e6445d12ef208a4ab4d61cf59107baa7186743b68f"
}
